Line,Time,Speaker,Discussion
1544,,Adrian,well I have a [Angela coughs]  ( ) suggestion for you to present to you in 
1545,,,a little while and before I do that I’ve got to run through the ecological 
1546,,,appraisal with you 
1547,,Chris,yeah
1548,,Adrian,erm I don’t know if you’ve had a chance to get a copy to Angela
1549,1:35:00,Chris,Angela’s not had a copy of this
1550,,Adrian,the ecological appraisal basically tells us we’re building a building in 
1551,,,the best part of the site for wildlife whoops but then as Chris also says 
1552,,,in his report the whole site was initially intended as a crematorium 
1553,,,anyway
1554,,Angela,the site has yeah I mean that but then again to be that’s in a sense 
1555,,,the site the wildlife wasn’t here before this crematorium was built the 
1556,,,crematorium has encouraged that wildlife
1557,,Chris,yes
1558,,Angela,in a sense [Adrian pulls out a drawing] so we’ve built that + wildlife up 
1559,,,because of this building and because because of the fact that we haven’t 
1560,,,developed that area because we knew there was talk of other sites and that 
1561,,,so the wildlife pre nineteen eighty two wasn’t even here you know I 
1562,,,doubt if there
1563,,Chris,there was a brick works
1564,,Angela,brick works you know and it wasn’t a development I mean it’s just a 
1565,,,farmers field I would think so the wildlife we’ve encouraged in a sense 
1566,1:36:00,,and so you know I don’t see that we can’t keep that and build it up 
1567,,,even more so I can’t see what the argument is personally as usual 
1568,,,we’ve got newts have we got crested newts
1569,,Chris,no he didn’t find any he thought there might be some
1570,,Adrian,yeah well
1571,,Angela,the last thing we want to do is to decrease the wildlife because people 
1572,,,come here for the pheasants and the muntjac deer and the squirrels 
1573,,,which in your garden you would see as vermin
1574,,Adrian,yeah well on that basis if you don’t want to decrease the wildlife then I 
1575,,,think we’re all singing from the same hymn sheet because Chris has 
1576,,,come up with some mitigation points in there + if we could run through 
1577,,,them I think they’re at the back of the report here somewhere [searches 
1578,,,through report] + + + sorry ( )
1579,,Angela,actually I’ve had a couple of chaps been in to do a from rps has been 
1580,,,in to see he’s coming to his yeah starting at the front + + + 
1581,1:37:00,Adrian,I’ll see if I can find my copy of the report and we can run through it 
1582,,,because Chris er talks about what I call the pier this is our memorial walk 
1583,,,if you like
1584,,Angela,yes
1585,,Adrian,(additional) pond in and the rill one of Chris’ first points was this 
1586,,,is actually barging straight through a nice wildlife area and Chris 
1587,,,suggests that we might consider moving this out the back perhaps to 
1588,,,connect it to this point put it in this direction this piece of land [Angela 
1589,,,coughs] is not of the same wildlife interest as that 
1590,,Chris,hmmm
1591,,Adrian,I think generally he’s trying to encourage me to pull back from 
1592,,,developing over here because this is like your best wildlife area so we 
1593,,,could reduce we could we could reduce our push into the forest here that 
1594,,,might actually have acoustic advantages so you don’t hear the tannoy 
1595,,,from the garage so so maybe the thing to do is to to just look at an area 
1596,,,closer here perhaps move this path a bit further over to maintain some of 
1597,1:38:00,,the forest there but I still like the idea of keeping this there’s an awful lot 
1598,,,of forest here an awful lot of land and I like the idea of the woodland 
1599,,,walk 
1600,,Chris,this is isn’t this the
1601,,Angela,allotments
1602,,Chris,this is allotments 
1603,,Adrian,yeah allotments beyond that line I think 
1604,,Chris,yes
1605,,Adrian,beyond that line
1606,,Chris,yeah
1607,,Adrian,so you know we could reduce this if you like to make it work but what 
1608,,,I was trying to do was to really open up this end of the site to make it 
1609,,,more useful
1610,,Angela,yeah well it it needn’t also there it’s nice ‘cause it balances the 
1611,,,building doesn’t it there’s got to be a certain amount of balance 
1612,,,between the building and the design features otherwise it looks sort of a 
1613,,,bit lost in nothingness around it which is what stevenage has got just 
1614,,,two little bays in front of it really they’ve got this lovely big building 
1615,,,and then they’ve got these two little boxed bays in front of the building 
1616,,,which are awful
1617,,Adrian,yeah what er colin coOK says is [reads  from report] there was valuable 
1618,1:39:00,,areas for wildlife ( ) bramble scrub it says see on plan two + wherever 
1619,,,that is C on plan two
1620,,Angela,yeah OK
1621,,Chris,so that is there [points to drawing]
1622,,Angela,there’s two ( ) which one does he mean this one or that one
1623,,Chris,well it’s the whole area
1624,,Angela,yeah but you see that’s only because somebody hasn’t been down 
1625,,,there to maintain it I mean when I first came in nineteen eighty seven that 
1626,,,grass that was grass that was never scrub that was scrub because of this 
1627,,,the car park here the third car park was mounded up and so that has only 
1628,,,really been there since about eighty nine so you know I mean it’s not 
1629,,,historical it’s just that we’ve done it because we haven’t done any work 
1630,,,on it
1631,,Adrian,it’s only been there about sixteen years
1632,,Angela,and nobody wants to go down there and deal with it I mean there 
1633,,,nothing I don’t think that’s particularly valuable it’s nice 
1634,,Chris,no what he’s saying is it’s developed into a habitat for birds isn’t it 
1635,,,because of the dense (scrub) and invertebrates
1636,,Adrian,so are you saying that all this area the scrub C the adjacent rough 
1637,:40:00,,grassland D and the (relicked) hedgerow A [reads from report] these 
1638,,,currently inaccessible areas will be largely or entirely lost to the proposed 
1639,,,development and effective mitigation is not possible he says well + 
1640,,,particularly intrusive is the formal parterre extending south-east from the 
1641,,,new chapel into the ( ) woodland + a general desira desider excuse me 
1642,,,a general desideratum would be to pull back development from the 
1643,,,south-east boundary he says reducing disturbance of the plantations 
1644,,,and preserving at least some blocks of native vegetation he says there 
1645,,,is some difficulty with the existing scrub vegetation bramble (dogrow)
1646,,,stinging nettles etcetera he says there are first rate wildlife plants but 
1647,,,people unfriendly not least on account of their rapid growth so at the 
1648,,,time what you were saying about it not being (every)
1649,1:41:00,Angela,if you’re going to have my thoughts on that is that even that scrub 
1650,,,needs to be managed better than it is now it’s not managed at all 
1651,,,there’s no management of it and even if you you’re not even managing 
1652,,,that scrub area properly really we’re not managing it and if you were 
1653,,,to actually professionally manage that scrub area I would think 
1654,,,you would have not have it like it is now even I mean it’s not managed 
1655,,,at all you know native plants you’d take the unnative ones out and 
1656,,,you’d clear we don’t have that many brambles so I mean I might be 
1657,,,wrong but I just think that’s that’s a fair point I’m not doubting that but 
1658,,,you know it’s-
1659,,Adrian,yeah  well what Chris says is to to mitigate what he’s just talked 
1660,,,about
1661,,Angela,hmm
1662,,Adrian,either [reads from report] truncate the parterre shorten its length or 
1663,,,reorientate it at ninety degrees to this axis towards the circular pond he 
1664,,,says also we could realign the footpaths away from the site boundary to 
1665,,,leave some large (in habitat) blocks undisturbed so we could pull that 
1666,,,path back (then) move this over as well maybe shorten this
1667,1:42:00,Chris,I think the trouble with that comment is that the only reason that we’re 
1668,,,able to develop this site is if we use it for memorial otherwise we’re 
1669,,,looking at another site entirely
1670,,Angela,yeah
1671,,Chris,because this is a very small site for this size of operation + actually 
1672,,,we’re going to have to maximise use of it for
1673,,Angela,yes
1674,,Chris,erm well not necessarily for modernisation but for scattering aren’t 
1675,,,we
1676,,Angela,yeah
1677,,Chris,now that doesn’t have to mean formal grassland does it
1678,,Angela,no that can be scrub area like it is now but more professionally 
1679,,,managed in a way erm so I mean it’s not to say that we couldn’t allow 
1680,,,a certain amount of brambles and scrub to be left I don’t think that’s a 
1681,,,problem but I mean it’s the fact that obviously he said it’s not people 
1682,,,friendly anyway erm I mean I-
1683,,Chris,/the different\
1684,,Angela,/nobody comes and\ monitors what we’ve got here to start with so I 
1685,,,mean he’s been offered the chance to come and monitor what we’ve got 
1686,1:43:00,,and no-one has ever done that and I mean I don’t quite know I mean 
1687,,,the amount that we’ve got on the boundary that we’ve got here that 
1688,,,they’re not going to be able to use anyway is you know is going to be 
1689,,,difficult to get to use anyway when I mean if this goes all the way I 
1690,,,mean this area here is still going to roughly be intact isn’t it 
1691,,Adrian,yes and what OK what I feel is in order to make sure you get planning 
1692,,,permission we need to be seen to be responding to these comments
1693,,Angela,yeah
1694,,Adrian,so I mean I think we can do that
1695,,Angela,if there’s other areas further into the the very sort of other area that we 
1696,,,can add more to I mean are we we’re adding 
1697,,Adrian,well yes indeed I mean I 
1698,,Angela,/we haven’t done anything with that really have we\
1699,,Adrian,/the plan also yeah I know the plan also shows what\ we’re trying to do 
1700,,,here we’re trying to create an axial wall here that’s on the axis of the 
1701,,,wreath court to a circular pond and again that’s on axis with this odd 
1702,,,construction here and trying to create spaces that might have seating in 
1703,1:44:00,,or whatever and the more woodland walks if you like [Angela coughs] 
1704,,,Chris has gone on in his report to show how the woodland walks might 
1705,,,develop he’s come up with sections showing what planting might be put 
1706,,,along the walks to make sure that they maintain erm + some some 
1707,,,ecological advantages if you like 
1708,,Angela,and to be fair the hedgerow that we’ve already got already down the 
1709,,,pond area we had ermthe existing area above the the yellow bit there the 
1710,,,ancient hedgerow part here there isn’t at the moment anything (a what) 
1711,,,even effecting this that we can’t add sort of more of a wildlife corridor 
1712,,,width to so we could add more to the width on this original hedgerow 
1713,,,here
1714,,Adrian,yes you could amplify this bit and 
1715,,Angela,yeah because that’s only the entrance into the memorial garden from 
1716,,,the other car parks and you wouldn’t necessarily put memorialisation in 
1717,,,that part because you know people walking in don’t necessarily want to 
1718,,,see memorials straight in their faces  
1719,1:45:00,Chris,there’s one issue that we haven’t got to yet which is the transport routes
1720,,Angela,yeah
1721,,Chris,and the (cabinet) member in particular wanted two distinct ways in 
1722,,,from the public to the chapel 
1723,,Angela,yeah
1724,,Adrian,two distinct ways in
1725,,Chris,so yes no well he wanted OK if you’re going to a service in this chapel 
1726,,Adrian,you’d go in this way
1727,,Chris,you’d go there
1728,,Adrian ,yeah
1729,,Chris,right if you go into a service in this chapel he didn’t like the idea that 
1730,,,you drove through here to here  
1731,,Adrian,oh + + + + + why didn’t he like that
1732,,Chris,he thought that there would be people that see that car park 
1733,,,immediately park and go into the wrong service
1734,,Adrian,well we do that with signage
1735,,Angela,yes
1736,,Adrian,I mean frankly I don’t see any other way of doing 
1737,,Chris,but then he was wondering 
1738,,Adrian,but that’s the cortege route
1739,1:46:00,Chris,yes but whether there was a + + + + + possibility of taking vehicles off + 
1740,,Adrian,+ + + erm 
1741,,Chris,and the cortege only continued under the +  + +  I think that’s a bit tight 
1742,,,isn’t it
1743,,Adrian,it is it doesn’t really feel as if that’s what it wants to be 
1744,,Angela,also got the problem with the other traffic + people visiting the memorial 
1745,,,for already existing 
1746,,Chris,yeah well we’re talking about making this a one way system aren’t we  so 
1747,,,that you know that you don’t if you’re visiting the cemetery you have to 
1748,,,come in this anyway so there will be traffic there and then they would 
1749,,,go down
1750,,Adrian,they’d go round this way anti clockwise route at the moment it’s 
1751,,,clockwise I’m saying we’re going to go anti-clockwise in the future
1752,,Chris,yes
1753,,Adrian,and erm we’ll bring the cortege in this way we’ll go through erm  I 
1754,,,discussed this with mkc highways and highways didn’t have a [Angela 
1755,,,coughs] (problem) so if highways didn’t have a problem with it I don’t 
1756,,,see why we have to take on board this (character’s) comments he’s not a 
1757,,,highways engineer + + +
1758,1:47:00,Chris,no it’s just about his concern that people will go into the wrong 
1759,,,chapel because as soon as they came in they’d park up and then
1760,,,wander down to this one and then find out the (wrong place they’re in) 
1761,,,and then walk so yes you’ve got to do it with signage but er signage 
1762,,,becomes a significant issue and how you do that
1763,,Angela,because signage would also be a problem to get them going the second 
1764,,,route wouldn’t it how do you separate them 
1765,,Chris,well
1766,,Angela,when they come in the gate how do they then know which which route 
1767,,,to take even at the start 
1768,,Chris,well if they’re following the cortege they just follow the cortege
1769,,Adrian,yeah you need
1770,,Angela,but most people would arrive early the only time they sort of follow the 
1771,,,cortege is if they at church first and coming for a committal most of the 
1772,,,people arrive before the cortege arrives
1773,,Chris,in which case you’re looking at some
1774,,Angela,/some\
1775,,Chris,almost /some\
1776,,Angela,/some\
1777,,Chris,real-time signs 
1778,,Angela,you’re looking at the name of the person highlighted in if you’re here 
1779,1:48:00,,for mr smith’s funeral go left if you’re here mrs jones’ funeral go 
1780,,,right really aren’t you because they will go they won’t go the way that 
1781,,,they’re even if you put different chapels unless you know they do ask 
1782,,,questions which chapel is it (go in) only one chapel yes but you know 
1783,,,the separation has got to be at the entrance which will obviously effect 
1784,,,the flow of traffic anyway whereas if you’re just bringing them into 
1785,,,one car park they’re sort of quite quickly coming in and you can then 
1786,,,quite quickly route them through the right place in a way even (if 
1787,,,they’ve) parked and come in to see us they then get told which route to 
1788,,,go to maybe I don’t know the concern is that you know they’ve all 
1789,,,got to be queuing up to get in to decide which side of the route they’re 
1790,,,going to take left or right whereas at the moment we’re saying 
1791,,Chris,yeah
1792,,Angela,you’re the wrong route
1793,,Chris,yeah then they’re still going to be queuing milling around here 
1794,,,thinking do I park here
1795,,Angela,yeah
1796,,Chris,do I go on do I park here
1797,,Angela,this is in a sense the issue of the wall
1798,,Chris,have I come in far enough
1799,,Angela,whether we’ve got it attached to the second chapel or you know 
1800,1:49:00,,everyone has the same problems I mean you just have to see how 
1801,,,amersham are dealing with they’ve got one building though you see 
1802,,,that’s a problem we haven’t got we’ve got two buildings and the 
1803,,,problem is we originally thought about trying to take them off the A5 
1804,,,into this chapel didn’t we but that’s not been allowed 
1805,,Adrian,my view is that you the people that are coming to the funeral have to 
1806,,,know whether the funeral is taking place at east chapel or the west 
1807,,,chapel and it can’t be that difficult having signage here that says east 
1808,,,and west chapel car parks this way and you have a sign here that says 
1809,,,west chapel car park straight ahead and you keep having signs up 
1810,,,west chapel car park straight ahead until they get there 
1811,,Chris,mmm
1812,,Adrian,and I don’t see that it can be that difficult really
1813,,Angela,and has this person been to a site similar to this then before or is it just 
1814,,,the thought that there would be this confusion just because they would 
1815,,,feel confused
1816,,Chris,I mean it’s the only issue ( )
1817,,Angela,it is yeah
1818,,Chris,which surprised me because I thought we wasn’t going to 
1819,,Angela,well that’s we’ve thought about that for quite a while haven’t we 
1820,1:50:00,,that’s why in a sense the ideal situation would be to add on a chapel on 
1821,,,to the existing building because you’re still using the same but we’re 
1822,,,not going to do that this is what the issue was with this and the thought 
1823,,,of perhaps trying to get them off the watling street into this one you’d 
1824,,,have a separate entrance completely but that’s not been + + that’s been 
1825,,,sort of taken out I think that’s not been allowed in a sense has it so that if 
1826,,,you’re coming to the east chapel you come in off of the danseed way 
1827,,,if you’re coming from west chapel you come into the watling street 
1828,,,but we’ve that’s not been allowed I think has it because of the amount 
1829,,,of traffic that they think will come in so you know coming up bring 
1830,,,them across and then into these two and a half car parks
1831,,Chris,I mean the car park corridor works well as well because you’re not 
1832,,,taking [Angela coughs] any vast additional space just for car parking are 
1833,,,you you can see it sort of flows there
1834,,Adrian,it’s an extension of the existing system isn’t it I mean this sort of 
1835,,,flowing system set up what we’ve done is- 
1836,1:51:00,Chris,continue it
1837,,Adrian,yes continue it and bring it to and end
1838,,Chris,yeah 
1839,,Adrian,I guess a link through there might help somebody who 
1840,,,accidentally follows the cortege and gets lost then when find 
1841,,,themselves stuck behind the hearse they can just nip in that way
1842,,Chris,yeah
1843,,Adrian,otherwise they’ve got to go all the way around the system and start 
1844,,,again which would be [laughs] a bit funny
1845,,Chris,it would be annoying 
1846,,Adrian,but even then would it be that much of a problem if they’d parked 
1847,,,around here [Angela coughs]  it probably wouldn’t would it they could 
1848,,,park there they could park here and just walk back it wouldn’t be the end 
1849,,,of the world
1850,,Chris,no + there’s putting a small road through there-
1851,,Adrian,I don’t like it it’s messy and Colin Cook wouldn’t like his (  ) 
1852,,,hedge (  ) messed up
1853,,Chris,it’s a signing issue isn’t it really
1854,,Angela,it’s a big signing issue which is 
1855,1:52:00,Chris,big signs here
1856,,Angela,there’s a real issue that we need to I don’t quite know how we’re going 
1857,,,to even even if we did it the other way and have a thing of it it’s still 
1858,,,going to be the issue to get them into the second chapel whatever we 
1859,,,do whichever route we take them through
1860,,Chris,the current sort of discrete signs we’ve got we’re going to have to be 
1861,,Angela,in your face
1862,,Chris,really in your face
1863,,Peter,it’s like the plane terminals isn’t it if you go to terminal one terminal two 
1864,,,terminal three
1865,,Angela,so how do they do that then
1866,,Peter,and you never quite remember which one your flight goes from can 
1867,,,you and then you drive past until you recognise your airline 
1868,,Angela,I’ve never flown I’ve only gone by boat to places I’ve never flown so 
1869,,,I’m a little inexperienced no I’ve never flown I can’t get off the 
1870,,,ground yeah so I mean those sort of places would be interesting to see 
1871,,Peter,well they have a ring road don’t they so that I mean if 
1872,,Angela,you just go back on yourself again 
1873,,Peter,yeah 
1874,,Chris,yes you go round more than once can’t you so if you make a mistake 
1875,,,you  go round again sort of thing
1876,,Adrian,you could get through there and go round again or get in the car park if 
1877,1:53:00,,only the hearse wasn’t in the way
1878,,Chris,well you don’t really want people driving through there
1879,,Adrian,no you don’t 
1880,,Angela,no
1881,,Adrian,so if they get lost they park here and they just walk to wherever they’re 
1882,,,going to go to 
1883,,Angela,I think the wildlife issues I don’t disagree with you can’t add to them 
1884,,,as well 
1885,,Chris,the reason I’m interested was because of this ancient hedge here if 
1886,,,you’re going to drive another road through it
1887,,Adrian,yeah and it goes along the edge I mean there’s a gap there already to 
1888,,,be honest and there’s a ditch there to be honest as well which is the 
1889,,,other + question yeah I mean there’s I can’t remember I’m trying to 
1890,,,think what this was like originally this was just flat so this has only 
1891,,,increased in the last few years so it’s not that we can’t increase it in 
1892,,,other parts you know we can’t add to it with some advice and help
1893,,Chris,so the issue is this do we want this truncated or moved
1894,,Adrian,a bit of both
1895,,Chris,a bit of both
1896,,Adrian,[begins to point at drawing] it would be nice to keep the pond and 
1897,1:54:00,,perhaps up to there and then put the rill perhaps over here erm
1898,,Chris,what do you call this
1899,,Adrian,we call it a rill it’s a very long narrow strip of water that might have 
1900,,,water rushing though it rick fields the landscape architect I 
1901,,,spoke to thought that would have wonderful potential for insects 
1902,,,because insects then to love to follow the water and that would really 
1903,,,amplify the insect garden so what I’d like to do is to perhaps take that 
1904,,,off there and put that down here and build lift that up + + and then this 
1905,,,path could come back and then link to the end of that or link to this
1906,,Chris,mmm
1907,,Adrian,move that over reduce this a bit mitigate the ( )
1908,,Angela,I don’t know could we not add sort of things around the paths I mean 
1909,,,would that help at all by adding more sort shrubs and trees 
1910,,Adrian,that’s what erm Chris is suggesting in this report
1911,,Angela,oh was he saying that you’ve got to move the paths back and (also 
1912,1:55:00,,increases) is that what he’s saying or not just +
1913,,Adrian,well what he’s saying is he’s offered a number of alternatives in here 
1914,,,he’s saying er well he’s offering options about what we could do with 
1915,,,the paths and + I think it would be really good if Angela could have a 
1916,,,copy to read
1917,,Chris,hmm
1918,,Adrian,and [reads report] + + +
1919,,Angela,I mean these are some of these trees in this area no over there erm I 
1920,,,think he’s been here before and said there’s not a great deal of quality 
1921,,,trees in there in a sense they’ve obviously just sort of self-seeded and 
1922,,,been left in there and so you know we can add more wildlife friendly 
1923,,,trees into that area as well there are a couple of oak trees over on this 
1924,,,side as well sort of just a bit down though that I think we talked about 
1925,,,like the one at selbourne you know the
1926,,Chris,mmm 
1927,1:56:00,Angela,yes one or two sort of quite nice oak trees that are quite big probably 
1928,,,been there for a few years now and so it would be nice to keep those as 
1929,,,well so I mean that’s I mean that’s I’m trying to think where 
1930,,Adrian,I must admit I kind of saw my site boundary as being sort of inside 
1931,,,here [points] but if you think that by saying that we’d we’d allow the 
1932,,,landscape architect to go further and develop this area that would be
1933,,Angela,well I mean we’re going to need the area for some sort of memorial 
1934,,,scheme as such and if you know this area hasn’t really got a great deal 
1935,,,of development potential at the moment we need to add to that these 
1936,,,trees are really I don’t they’re only sort of willows which are nice and 
1937,,,they have some wildlife but they’re they’ve you know we’ve not 
1938,,,concentrated on developing this area for memorialisation
