Line,Time,Speaker,Discussion
,,,
1,,Peter,this is the new-
2,,Adrian,this is the new-
3,,Peter,ah the completely new one
4,,Adrian,[points to drawing] we’re in there looking out at that bit there you 
5,,,parked just here so what we’re trying to do is to extend the car park 
6,,,here to make an entirely new car park and the idea is that basically you 
7,,,enter here and by signposting you’re directed as a cortege if you like 
8,,,this way the cortege would park there whereas the present cortege 
9,,,would park here and you go into this chapel and have your service 
10,,,where this chapel gets a garden round the back this chapel gets a 
11,,,garden round here
12,,Angela,we’ve put these (images) up
13,,Adrian,I’m impressed
14,,Angela,are you oh well I got those from the website for the-
15,,Adrian,kimble
16,,Angela,from the kimble museum so that people could see what we were 
17,,,trying to do so I copied them to show them what they idea was and 
18,,,where it came from I put them up so that people could see and 
19,0:06:00,,everyone could sort of comment and have some sort of feedback from 
20,,,that just to start with even just at this stage really
21,,Adrian,good well I’ll look forward to hearing the feedback because that’s the 
22,,,purpose of the meeting after all yeah that’s great
23,,Peter,I’m Peter Lloyd by the way
24,,Angela,hello Peter pleased to meet you where are you sitting Chris
25,,Adrian,this is Angela Abbot registrar of the cemetery excuse me for not 
26,,,introducing you we’re still waiting for one we’re waiting for Ben Hill 
27,,Angela,I’ve just recent- I’ve just purchased a new book called british 
28,,,crematoriums: history architecture and landscape
29,,Adrian,oh right
30,,Angela,I tried to go through the sap system it was a complete nightmare so I 
31,,,brought it myself because it’s just a waste of time doing it through sap 
32,,,so I shall get that and I’ll have a read of that as well it’s a recent book
33,,Adrian,[reads] Hilary Granger you told me about Hilary Granger before
34,,Angela,yes she’s been to have a look at our existing we’re mentioned in the 
35,,,book quite a bit with the existing chapel she was quite impressed 
36,0:07:00,,because we’ve also got quite a lot of photographs and other things and 
37,,,plans like the forward plan of extending the chapel originally the original
38,,,idea so that was quite forward thinking in nineteen eighty or seventy 
39,,,whenever seventy eight when they decided on that + so I’ve sent off for 
40,,,that but you try and get them to raise a sap order for it and you get how 
41,,,often will we need the spire books company I said well we’ll never use 
42,,,them again probably why do you need to do that oh for god’s sake
43,,,so I just went out and bought it and the one above as well a history 
44,,,of cremations that’s what we have at home on the bookshelf [all laugh] 
45,,,cheerful reading like you when you go on holiday with your part- your 
46,,,husband and wife + you see a sign for crematorium straight away 
47,,,ignoring them [all laugh] whether you’re abroad or in this country the 
48,,,first thing you do straight away oh not another cemetery they go oh dear 
49,0:08:00,,how dare you + yeah so committed to the cleansing flames is the 
50,,,other one I brought yeah ++ very interesting sorry actually that looks like 
51,,,the one they went to have a look at in nottingham I think when they 
52,,,designed this one they went to quite a few places
53,,Chris,is that the eh ++ drive through one
54,,Angela,no the new ones yeah well that- no I said to you they all look like tescos 
55,,,but Andy said to me you know what they look like are mcdonalds drive 
56,,,through and they do they do look like that they look awful look that’s the 
57,,,new one up in nottingham no inventiveness
58,,Adrian,a lot of people feel at home going to mcdonalds
59,,Angela,yes it’s wrong for me to criticize because they’ve obviously had it 
60,,,designed and it obviously works for them it obviously works for this 
61,,,company and they’ve obviously got somebody that has done the plan 
62,,,and they’ve just reused the design but I cannot understand like she said 
63,,,really there you know should be some well anyway you know it looks 
64,,,like a mcdonalds drive through and they all look near enough the same 
65,,,which is awful shame there’s a about six or seven of them and they’ve all 
66,,,got this sort of mcdonalds drive through tescos don’t know where you 
67,0:09:00,,are sort of look
68,,Adrian,well hopefully we’re offering you something a bit different
69,,Angela,well that’s what my brief is when I’m telling people I’m saying to 
70,,,people
71,,Adrian,and now for something completely different
72,,Angela,yes why not why not take the opportunity to do that
73,,Adrian,exactly but as I was just saying to Peter earlier you know it’s a dream 
74,,,come true for an architect to do such a project so I’m very excited by it 
75,,,erm the purpose of the meeting as I see it is to obtain your feedback to the 
76,,,design having received erm Chris’s order for to work to proceed up to 
77,,,planning when was it a few weeks ago now and + we thought it would be 
78,,,a very good idea to have another meeting to update everybody as to 
79,,,where we’ve got to and to receive your feedback because the last time 
80,,,you and I met Angela you said you were interested in talking to funeral 
81,,,directors and so on and so forth obtain feedback from people who’d be 
82,,,using the building
83,,Angela,which is everyone that’s come in has been dragged in to show even 
84,0:10:00,,my mum’s had a look [laughs]
85,,Adrian,well the design has developed a wee bit since erm you saw it last time 
86,,,erm the design obviously is still in exactly the same place but the design 
87,,,is extended to include the actual cremator facility so if I can start 
88,,,with this particular drawing err you’ve seen a version of this drawing 
89,,,before basically we’re arriving in the new car park in this area and 
90,,,from the car park we’ll enter the building through a waiting area this this 
91,,,leads us to the first query I have because um there was some discussion 
92,,,about whether you wanted the size of the waiting room increased at 
93,,,the moment it’s exactly on brief but it does look + kind of small to my 
94,,,eye in relation to the size of the project
95,,Angela,yes I’d be interested to know in a sense what sort of seat- er how many 
96,,,seats in a sense you could get in a sense that most people arrive 
97,0:11:00,,probably at least
98,,Secretary,[knocks on the door] is Ben here (  )
99,,Adrian,we’re expecting Ben
100,,Angela,yes but the heating people I’ve said I won’t be able to see them until 
101,,,possibly later this afternoon or tomorrow afternoon is it mr bonnington 
102,,Secretary,yes it is
103,,Angela,he was wanting to go down to animal control to start looking
104,,,at the work in there but I did tell him I had a meeting all 
105,,,morning and tomorrow morning as well
106,,Secretary,and tomorrow morning
107,,Chris,yes I mean if you take him over to animal control
108,,Angela,that’s what is got he came here to do 
109,,Secretary,he knows what he’s got to do-
110,,Chris,Yes (  )
111,,Secretary,OK [leaves room]
112,,Adrian,to answer your question it’s a relatively small room the area is similar 
113,,,to the existing waiting room and as such you are unlikely to get more than
114,0:12:00,,about eight to ten maximum twelve seats in there I would have thought 
115,,,probably because the building well the room is doing so much its 
116,,,allowing people through into the porch area it’s also allowing access to
117,,,the loos so my first question to you is is waiting the room big enough and 
118,,,would you like us to increase it
119,,Angela,I would say although the time spent sitting and waiting might not be 
120,,,very long and eight seats seems enough at some stages even our waiting 
121,,,room is too big so its slightly I’m also thinking of the fact that if we’ve 
122,,,got a flow of people walking through that then restricts us we can’t put 
123,,,seats through that because in a sense we need to keep an access open 
124,,,and so the seating will be against the wall
125,,Adrian,what I’d recommend is that we look at doing something like that 
126,,,extending it which will give you seating areas here seating areas here 
127,,,seating areas here as well as here and here which effectively will double 
128,,,the seating capacity from what I was just saying
129,,Angela,yes I mean people waiting for cabs or for people waiting to be picked 
130,0:13:00,,up as well for services you know it might not sort of eight might be more 
131,,,than enough for funerals for the majority of the time but I would think 
132,,,it’s nice to give them a bit more space as well because we might get 
133,,,people waiting for the eleven o’clock funeral erm and people at the ten 
134,,,o’clock perhaps arrive and so they keep in their little groups they don’t 
135,,,want to mix with other people so the feeling of keeping them segregated 
136,,,just because they don’t know the other people might also be there and we 
137,,,do have problems with families like that during funerals they don’t 
138,,,want to be [laughs]
139,,Chris,police attendants [laughs]
140,,Angela,police attendants quite often you know you’d think it would bring 
141,,,them together but it actually makes it worse
142,,Adrian,really gosh
143,,Angela,yeah and they sit separately in the chapel as well it’s all to do with 
144,,,money and you know they’ve left someone something wonderful 
145,,,that’s most of the time what it is or the other family are cross because 
146,,,one family has arranged it and they used  they never visited her while she 
147,,,was alive and how dare they get involved with this and it all escalates
148,,Peter,it’s like east eastenders [all laugh]
149,0:14:00,Angela,indeed I mean yes it can escalate to sort of violence at times not here so 
150,,,far but threats of it at times so the idea that number one we have people 
151,,,for other services arriving perhaps at the same time they want to keep 
152,,,separate families like to keep separate and also the fact that perhaps 
153,,,people are waiting for lifts or other things as well perhaps they’ve had 
154,,,the service and they come back in the waiting room to wait for someone 
155,,,to pick them up or just because they’re waiting for the taxi or 
156,,,something
157,,Adrian,ok
158,,Angela,so I’d like it a little bit bigger I think + not hugely because there is it is 
159,,,a wasted space most of the day really 
160,,Adrian,Yeah well I would have thought another couple of metres on there [writes 
161,,,on drawing] would do the trick so shall we agree a two meter extension 
162,,,yes or thereabouts hmm
163,,Angela,I mean the other suggestion that perhaps I could make at this stage 
164,,,would be perhaps for a small amount of outside seating because people 
165,0:15:00,,like to smoke at funerals they like to have a and the seat that we’ve got 
166,,,out by the car park at the moment the half seat even if it’s cold and not 
167,,,very nice is actually people feel more happier out there then they do 
168,,,sometimes in the waiting room
169,,Adrian,yes well we can certainly add some outdoor seating out here if you 
170,,,wish we have got some outdoor seating here we’ve got a number of 
171,,,benches there erm but we can add-
172,,Angela,people like to
173,,Adrian,more in this area if you wish
174,,Angela,especially if we have a no smoking policy in the waiting room which 
175,,,we have now people like to mess up our grounds with their cigarette 
176,,,ends +++ just a thought that they also don’t like they don’t know where 
177,,,they’re going most of the time even if you were to point them in the right 
178,,,direction and they feel frightened most people attend the funeral don’t 
179,,,want to actually be right next to the family because they don’t want to be 
180,,,in their face and they don’t want to get involved with it but they want to 
181,,,attend the funeral and so it’s awkward they want to stand back a bit they 
182,,,want to be seen that they’re there but they actually don’t want to actually 
183,,,even perhaps sometimes speak to the other people you know so they quite 
184,0:16:00,,often hang back a bit and so the idea of putting here [gestures over 
185,,,drawing] would be quite nice because they wouldn’t they could see the 
186,,,funeral arrive and then they could sort of still stay here it’s like getting 
187,,,them into the chapel but we’ll talk about that once we get to that stage we 
188,,,can’t get them to move up front because I don’t know them that well you 
189,,,know that sort of thing I’m just saying what happens at a funeral they say 
190,,,oh I don’t really know them that well I’m not related to them and so if 
191,,,they’re here they’re important people for attending a funeral but they 
192,,,actually don’t particularly want to be that far up the front they don’t 
193,,,want to be sort of the people that they have to deal with the main 
194,,,mourner
195,,Adrian,OK ++
196,,Angela,so it would be nice to do something
197,,Adrian,yes + so having got this this far we’ve got a bigger waiting room loos and 
198,,,loos also using for disabled persons in the porte cochere we’ve got a 
199,,,grand porte cochere it’s wider than the existing porte cochere erm I think 
200,,,last time you commented that was quite a nice idea again people can mill 
201,0:17:00,,around here [gestures with pen] and wait and the way it’s designed at the 
202,,,moment they can wait and enjoy the pond [points] look at this area look 
203,,,at the planting and erm ++
204,,Angela,the funeral directors are a little bit concerned about that with regard to 
205,,,their access for their hearses that’s one of the comments that we’ve 
206,,,had and so we’ll need to get some sort of feedback as to what they 
207,,,perhaps need to do I mean obviously in a sense what they’re concerned 
208,,,about is if they’re coming down here [points] they’ll probably only get 
209,,,their hearses around to this area to carry in
210,,Adrian,that wasn’t the idea I was anticipating that the hearses would be 
211,,,parked here [sketches]
212,,Angela,were there OK that’s fine yeah
213,,Adrian,exactly as they are at the moment that the coffin would be drawn out 
214,,,here and they would simply [points] walk it in I wasn’t thinking that 
215,,,they’d try and park
216,,Angela,no that’s OK
217,,Adrian,in there
218,,Angela,yes well that’s what they’re wondering how that would work then so 
219,,,we’d work I wasn’t quite aware
220,,Adrian,we’d work it exactly the same way as the present system I mean 
221,,,maybe this should be made more obvious by perhaps a different colour 
222,0:18:00,,in the paving or something [sketches] I mean what I’m trying to say here 
223,,,is that that’s the vehicular line [sketches]
224,,Angela,yes
225,,Adrian,and that these areas [points] are for people to mill about in and you’ve got 
226,,,a place for people to stand
227,,Angela,yes they will probably want to know how [points] how + how  far that is 
228,,,from the because they’re going to be possibly carry the coffins in and 
229,,,most of the men are sort of in their seventies and eighties [laughs]
230,,,carrying the coffin
231,,Adrian,that’s only eight metres there’s not a huge difference
232,,Angela,that’s alright so long as I yes I mean they’re not criticising they’re 
233,,,just wondering how the flow of vehicles goes and where I mean 
234,,,they’re looking at it from their angle we’re looking at it obviously 
235,,,trying to make sure everything’s covered so they wanted to know 
236,,,roughly where they went how would they park how would they then 
237,,,offload the coffin normally by carrying on what we call shoulders so 
238,,,they would carry on a shoulder so that then obviously the area the 
239,,,length of that is important to them
240,,Chris,the other thing is they could use a bier
241,0:19:00,Angela,they could use a bier yes they don’t particularly like to they find it 
242,,,undignified some of them at the moment ++
243,,Adrian,to use a trolley
244,,Angela,a trolley yes I mean it’s health and safety it’s much easier for them to do 
245,,,that and the original concept of this chapel was that the bier the 
246,,,catafalque would actually come out and meet the hearse and it would 
247,,,be put on to the catafalque and then they would then wheel that in on 
248,,,there and so that was the original idea but that never really worked
249,,Chris,mainly because of the funeral directors
250,,Angela,funeral directors and the fact that they’ve always carried coffins in 
251,,,through churches and things like that there’s still this concept of doing 
252,,,it of sort of shouldering them carrying them in
253,,Chris,I think I mean the idea would still be that that would be the a flat 
254,,,route through [points]
255,,Angela,yes
256,,Chris,for a
257,,Adrian,yes (  ) a flat route through
258,,Angela,but they just wanted to know as to where they would I mean although 
259,,,I actually haven’t that’s my fault I remembered that from my 
260,,,discussion so that was they just wanted to know where do they park 
261,,,their vehicle [gestures] do they come round and they’re looking at it from 
262,0:20:00,,their side so that’s important to them that we make sure we you know
263,,Chris,the other thing if you’ve got erm several funeral vehicles cars carrying 
264,,,mourners they were coming through it as well [points] they’re currently 
265,,,how do they sort themselves out if there’s more than say four four of 
266,,,them
267,,Angela,yes what happens [gestures] on the existing site is that we that the hearse 
268,,,draws up as the main vehicle and we can get two [begins to point] 
269,,,limousines side by side underneath the erm porte-cochere and then one 
270,,,area by here as well so we can get two limousines underneath the covered 
271,,,area and one just under here which is why we’ve got the stepping stone 
272,,,sort of paving slab by my office out there so that if they it’s not wide 
273,,,enough for them to open the door and to get on to the path or road they 
274,,,have to get on to the grass area on this side ++++
275,,Adrian,I’ve shown four metres there which is + a bit tight for two cars to park 
276,0:21:00,,side by side so would you like me to widen this [writes] +
277,,Angela,I don’t if the if the the hearse will draw up to possibly they will draw it up 
278,,,to about here [points] and then as long as sort of a couple of vehicles can 
279,,,get underneath here the majority of them are I would say two hearse 
280,,,funerals
281,,Chris,two car
282,,Angela,two cars two limousines and the hearse so you’ve got three vehicles the 
283,,,majority very rarely do you get three family cars erm but obviously if 
284,,,you’ve still got space to carry them down one here one here as well then 
285,,,that’s enough room then to meet
286,,Adrian,if if the hearse moved up a little bit further [begins to sketch] and there 
287,,,was coffin space there you would have space for 
288,,Angela,space for those above the coffin area yes
289,,Adrian,side by side here
290,,Angela,yes and you’ve got to obviously allow for the doors to open for them 
291,,,to get out easily
292,,Adrian,yes I’m sure there’s space for that
293,,Angela,I’m sure there is and then like I say if there’s another limousine here 
294,,,then that would be in a sense like we have at the moment
295,,Adrian,so you could put a third one here if you wanted
296,,Angela,yes so that’s what they’re looking at from their side is how do they 
297,,,arrive where do they put their vehicles and how easy is the access into 
298,0:22:00,,the chapel so that’s what their remit is to look at that ++
299,,Adrian,OK so you didn’t see any alterations necessary to make that work
300,,Angela,not no as long as there’s a that’s what they’re I mean if we have a sort of 
301,,,consultation meeting with them that’s what they will be interested in 
302,,,they’ll be slightly interested in this side but they are only interested in 
303,,,how they arrive how do they offload the coffin how do they deal with that 
304,,,into the chapel and sort of how do they then get their vehicles to the 
305,,,wreath court which is the other issue that they’ve got but we’ll get there 
306,,,when we get to that bit 
307,,Adrian,OK my only point is that it would be relatively simple to widen that 
308,,,[points] a wee bit if that was helpful to you
309,,Angela,yes
310,,Chris,I think it possibly would be
311,,Angela,yes [points] in a sense to just these bits here what is- is that-
312,,Adrian,this is a planting bed at the moment so it would be quite simple to 
313,,,widen it a wee bit [sketches] if you thought it was helpful but
314,,Angela,so what we have is the [points] doors open here so they’re opened on to 
315,,,this side and people can get access but because they’ve left the doors 
316,0:23:00,,open wide enough here on this side at the moment they’re not wide 
317,,,enough and so we’ve had to put like a little paving area here that’s not  
318,,,particularly attractive so it’s got to be wide enough for people to have 
319,,,the doors open and also wheelchair access sometimes that’s what we’re 
320,,,looking at people obviously arriving in wheelchair vehicles as well and 
321,,,sometimes you get limousines and then you get perhaps a disabled bus 
322,,,as well for people being delivered funerals +
323,,Adrian,OK [begins to point] so having got this far everyone is now under cover 
324,,,at this point erm + the way it’s designed at the moment the roof edge is 
325,,,actually on this line here + so that’s the bit that covers you OK so that is a 
326,,,length of about nine nine metres or so OK + from this point you go 
327,0:24:00,,through a lobby into the chapel and the chapel layout is quite similar to 
328,,,the existing chapel where it gets different is that we have what I call a 
329,,,sanctuary to one side or an ante chapel for the very small funerals and we 
330,,,have a much more dominant catafalque design at the end
331,,Angela,thank you yes
332,,Adrian,erm last time we spoke Angela you thought that that the original 
333,,,catafalque design just wasn’t bold enough
334,,Angela,here wasn’t enough
335,,Adrian,yes
336,,Angela,yes
337,,Adrian,it just you know I felt that architecturally it needed to be a great deal 
338,,,more bold to make a statement about it being a very important
339,,Angela,that’s in a sense what they are all there for is what’s on that compared 
340,,,to to look at it and to focus their feelings on that area really that’s what 
341,,,they’re there for whether they want to or not ha ha ha 
342,,Adrian,so my next two questions are are the sanctuary and the catafalque big 
343,,,enough erm coming to the catafalque first last time I spoke to you with 
344,0:25:00,,mister (  ) he was saying that erm there might be the possibility of a 
345,,,double funeral in which case would this be wide enough for two
346,,,coffins ++
347,,Angela,it wouldn’t probably I don’t know 
348,,Adrian,it’s just over three metres diameter it’s about three point one metres 
349,,,diameter
350,,Chris,how wide is the existing er trolley
351,,Angela,I don’t know I think I would say it might just I mean at the moment they 
352,,,can just they can just go in side by side but it’s difficult to squeeze in to 
353,,,put the coffins on at the moment even because you’ve also you’ve got the 
354,,,two catafalques in side by side and you need to have four routes for 
355,,,people to go either you need the one in the middle for both people to go 
356,,,and the ones at the end for them to drop the coffins off erm but even two 
357,,,catafalques isn’t always enough we’ve had three or we’ve had car 
358,,,accidents you know we’ve had three coffins and we’ve not been able to 
359,,,accommodate all the you know I mean if we can do two that’s the 
360,0:26:00,,majority of them put them side beside or in the sense perhaps have the 
361,,,catafalque so it can expand to accommodate two I don’t know one 
362,,,catafalque that spreads out like a sort of a table or something I don’t 
363,,,know
364,,Adrian,OK I thought the catafalque was the name of the space it’s obviously 
365,,,the actual thing that you put the coffins on
366,,Angela,the actual thing yes some people call it like an altar the catafalque is 
367,,,the actual place erm where you place the coffin
368,,Adrian,OK so my question for you is how wide would it need to be for two 
369,,,coffins or if we’re going for two it would need to be
370,,Angela,we’ll have a measure up on that
371,,Chris,[points] there’s also the entrance as well isn’t there and how it fits in and 
372,,,how it’s visible
373,,Angela,how it would be visible for people on the corners
374,,Chris,in there maybe that side of the design would need to be cut back a bit 
375,,,but still maintain-
376,,Adrian,well [begins to sketch] there’s a couple of things I can do I can make the 
