Line,Time,Speaker,Discussion
377,,,whole thing bigger for a start to help you make this work I can also splay 
378,0:27:00,,the opening a little bit wider as well so you’ve got an even better view in 
379,,,if that helps and that would certainly enable you to get a wider catafalque 
380,,,inside there that might be suitable for two people the architectural 
381,,,idea here is to have like a cylinder which will be top lit at the top 
382,,,perhaps a glass pyramid something like that so you can get top light 
383,,,pouring down into it there might be some very nice artificial lighting 
384,,,inside as well to (  ) that so that erm [phone rings] oh I’m 
385,,,terribly sorry rule number one  turn your mobile phone off when you 
386,,,have an important meeting
387,,Angela,might be Ben ++++
388,,Adrian,[operates mobile phone] it is Ben +++++ just turn it off so it doesn’t 
389,,,happen again so if you’d like me to increase the size of that space I 
390,,,certainly can do
391,0:28:00,Angela,how many people would you get on the seats roughly how many
392,,Chris,are we going to have fixed seating
393,,Angela,I don’t know that’s the next sort of thought I was-
394,,Adrian,its one of your questions isn’t it
395,,Angela,yes
396,,Adrian,[begins to write] seating
397,,Angela,I’m just trying to think if people are at the end of those seating they 
398,,,also need to be able to see the coffin because they tend to sort of not 
399,,,really work out you know the importance of which mourner sits where 
400,,,really they tend to just scrabble on to the seats as best they can there’s no 
401,,,set defining you know the main mourner sits on one end they tend to 
402,,,shuffle all up on one seat at the front erm and so as long as they can see 
403,,,coffin from where they’re sitting it’s obviously that’s the most 
404,,,important thing just briefly to mention with this that was received 
405,,,quite with the people that I’d spoken to as a very nice area they felt 
406,,,that was very good they only thing they had was would there be a door 
407,,,on that so that there would I mean how open would it be in the sense 
408,,,that if the service was going on in a normal chapel obviously is that sort of 
409,0:29:00,,something that people could see into or would it be a closed off area 
410,,,that can be-
411,,Adrian,I didn’t see it as being a doored off space I mean rather like an 
412,,,antechapel in a cathedral or whatever I just saw it as a space that you 
413,,,could walk in to 
414,,Angela,yes that’s fine
415,,Adrian,er is that how you saw
416,,Angela,yes yes that was kind of positive they felt that was quite a nice idea to do 
417,,,that especially for the childrens’ funeral we have the hospital chaplain 
418,,,that does all the babies funerals from the hospital and you know you 
419,,,only get mum and dad on that if at the most and it would be nice to be 
420,,,able to do that whether that would be for a full adult coffin I don’t 
421,,,know whether that was the design of it no 
422,,Adrian,don’t think don’t think that wouldn’t work it’s actually quite a small 
423,,,space and again I’m wondering if it needs to be increased in size we 
424,,,certainly can increase it in size at the moment it has a diameter of about 
425,,,three point one metres so there’s a floor area of really seven square metres 
426,,,so by the time you’ve got three people in there and a small coffin perhaps 
427,0:30:00,,for a child or something that’s filled the space up
428,,Angela,yes but it’s still (  ) at that it was thought of as being very nice 
429,,,you know a nice area even hmmm
430,,Adrian,so what would your view would be on that do you think we should 
431,,,increase it in size
432,,Angela,I would be concerned that if we make it too big it loses it’s sort of
433,,Adrian,intimacy
434,,Angela,yes yes you know I’m not sure I quite like it being a small space in a 
435,,,sense so I mean see whether that maybe just a little bit bigger but I’m 
436,,,quite happy with that as it is really I quite like the idea of a smaller 
437,,,place so the intimacy on that
438,,Adrian,well it would give me reassurance if maybe you could chalk out a three 
439,,,point one diameter circle on the ground somewhere 
440,,Angela,yes so we can see-
441,,Adrian,and and + perhaps we’ll all have a look at it and 
442,,Angela,see how big that is
443,,Adrian,see what you think
444,,Angela,as I say a little bit bigger maybe but-
445,,Chris,how many people come to those sort of services
446,,Angela,what to the babies ones mum and dad and the hospital chaplain and 
447,,,the chapel attendant
448,,Chris,no grandparents or-
449,,Angela,very rarely very rarely not very often sometimes you get lots but then 
450,0:31:00,,you’d use the main chapel for that and again the suit to the catafalque 
451,,,in that area then needs to be adaptable so that it doesn’t get lost on 
452,,,there we know and some adaption needs to be made so that cushions 
453,,,or something’s made so it’s not seen as little tiny coffin on the big 
454,,,chapel you know you get occasionally you get lots of people for them
455,,Chris,yes so we need to check that dimension works don’t we
456,,Angela,yes yes at the moment what happens with the ones from the hospital is 
457,,,that they go on to the main catafalque on to a cushion and then the mum 
458,,,and dad and the hospital chaplain will go round into the curtained off 
459,,,area stand around there with chairs and candles and sit there so the the
460,,,dimensions of the area that we’ve got in our existing chapel at the 
461,,,moment is more than enough for what they do then so probably 
462,,,although it’s oblong this is obviously about the same sort of size I 
463,,,would think yes we need to have a think about that
464,,Chris,yes this connection point for us to do is check that size
465,,Adrian,ok
466,0:32:00,Angela,I can’t work in metres
467,,Adrian,alright we’ll try and convert it to-
468,,Angela,no no no I must do I must do I’m not you know three metres I have to 
469,,,think about it
470,,Adrian,nine feet
471,,Angela,that’s alright then that’s OK [writes]
472,,Adrian,OK + did you see this as a space that might have it’s own small lectern in 
473,,,it or some altar like feature inside it
474,,Angela,it would be nice to have something like that yes I think we talked 
475,,,About erm perhaps doing something with it in a sense of erm coloured 
476,,,glass or something coming through didn’t we
477,,Adrian,definitely I’ve showed
478,,Angela,I’m thinking of coventry cathedral with the 
479,,Adrian,oh yeah I know what you mean I’ve shown a very tall narrow slitty 
480,,,window which faces directly south if my orientation is correct or is it 
481,,,west
482,,Angela,little bit that’s north [gestures] that would be north up this way +
483,,Adrian,it faces directly
484,,Angela,south-west +
485,0:33:00,Adrian,it faces directly west to get the setting sun in it that was the original 
486,,,idea I wanted to give you a small view of the pond as you came in and 
487,,,you get a small view through it of the pond but if it’s stained glass it’ll 
488,,,be a much more intimate space again top lit so you get sun and feeling 
489,,,of any cloud movement overhead but essentially it’s a very private 
490,,,sanctuary that’s why it’ll be the sanctuary on the plan
491,,Angela,yes I’m very pleased with that yes
492,,Adrian,if you want to we could puncture the wall with some more ++ holes if 
493,,,you like what I’m thinking of is like le corbusier’s chapel at 
494,,,ronchamp I’m not sure if you’re familiar with that this chapel has some 
495,,,[begins to sketch] holes that might have a tiny bit of stained glass in them 
496,,,but might in three dimensions look something like that so that if that’s the 
497,0:34:00,,outside and this is the inside you got small amount of covered light 
498,,,reflecting itself off the walls
499,,Angela,what into a deep a deep wall
500,,Adrian,a deep wall it’s a very deep wall walls at least three hundred millimetres
501,,,thick there and it would be there would be the opportunity to have the 
502,,,odd small piece of glass that might let a little splash of colour in-
503,,Angela,yes that would also be nice because if the water there’s a sense also that 
504,,,would also make the light move in a way through the glass if it was 
505,,,coloured you know you’d get the water as it moves or reflects as well 
506,,,then that changes the +
507,,Adrian,yeah I know what you mean particularly if some of these were 
508,,,relatively low you might get a reflection from any movement in /the 
509,,,water\
510,,Angela,/the water\
511,,Adrian,I saw the pond initially as being quite still but there’s no reason why it 
512,,,couldn’t have a fountain in it or something to give it
513,,Angela,yes but even if it was still I would think it would be something 
514,,,reflective wouldn’t it even through the light from the you know yes 
515,,,I’m quite keen on sort of developing that that erm that’s one of our 
516,,,unique sort of things not many I don’t know of any other crematorium 
517,,,chapel that’s got something as unique as that so you know I’m very keen 
518,,,to sort of keep that in there and use that 
519,,Adrian,good so in principle you really like the idea of its spirituality being 
520,,,amplified to make it very calm 
521,,Angela,yes
522,,Adrian,and spiritual
523,,Angela,yes
524,,Adrian,relaxing
525,,Angela,yes
526,,Adrian,meditative sort of space
527,,Angela,yes not even necessarily particularly for funerals but for sort of 
528,,,memorial services or something that people could come to later or some 
529,,,area to come and visit to spend some time people sometimes like 
530,,,coming back in the chapel and you know when we’ve got no services 
531,,,on for sort of private reflection or something so there’s nothing saying 
532,,,that they couldn’t do that but that would allow them to have an area as 
533,,,well that they could also just sit in quietly and sort of that would be 
534,,,quite nice 
535,,Adrian,and should it therefore include perhaps some built in seating a built in 
536,,,bench for a couple of people or /something like that\
537,,Angela,/something like that\ yes something whereas you know the seating that we 
538,0:36:00,,might go for whatever something around the edge so there’s definitely 
539,,,one at the city centre church that I remember I remember that there’s an 
540,,,area there that you can it’s a circular area you can pull the door round and 
541,,,close it but whether it’s still there or not I don’t know you can cut it 
542,,,off the door 
543,,Chris,I sort of vaguely recall it
544,,Angela,yeah I can’t remember a hundred percent its been quite a while since 
545,,,I’ve been there I have enough religion during the day ha ha ha I’m 
546,,,religioned out by the end of the day
547,,Adrian,yeah +
548,,Angela,OK
549,,Adrian,OK well that’s helpful we’ve dealt with the sanctuary now we’ve dealt 
550,,,with this area you know all about the audio visual room which hasn’t 
551,,,changed since the previous submission
552,,Angela,OK
553,,Chris,we’ve got an issue (  ) considering following a training session 
554,,,that the staff went on this week at erm stevenage crematorium to look 
555,0:37:00,,at use of the audio the new audio digital audio system that had been 
556,,,installed and a particular issue is the accommodation and [begins to 
557,,,gesture] having accommodation where they can work almost like a theatre 
558,,,technician so that they can be part of the service yet be divorced from the 
559,,,service so that they can operate PCs and things erm but also be in sight of 
560,,,what’s going on so being more involved so we’re currently looking at 
561,,,bringing stuff out the back of the existing chapel so that they can sit at a 
562,,,desk away but part of 
563,,Adrian,well well that’s the desk [begins to point] that I thought they could work 
564,,,at I saw this as being combined organ and AV control so someone might 
565,,,sit here and play the organ and there might be AV controls here but 
566,,,essentially all the spaghetti and all the amplifiers and CD players cassette 
567,0:38:00,,players you name it computers and so on and so forth could be in here
568,,Chris,hmm
569,,Adrian,but there’s no reason why there couldn’t be a small laptop or whatever 
570,,,attached to that system
571,,Chris,yeah I’m with you ++ yes I mean yes I mean you saw how the system (  )
572,,Angela,yes I would have to say [begins to write] that what I would ask if possible 
573,,,is that we swap these two bits around in a sense that we have sort of the 
574,,,the room here so that we can see across here cause at the moment if we 
575,,,were working the laptop what we what we felt here the staff feel is that 
576,,,people come to a funeral and they don’t particularly want to see someone 
577,,,sitting at a laptop doing tippy tap tippy tap like that and they felt that that 
578,,,was perhaps erm the concern we had so the idea is of in a sense is hiding 
579,,,that although it’s obviously a modern an idea 
580,,Adrian,you could hide them in there [points] (  ) visual link
581,,Angela,the problem with that would be yes they wouldn’t be able to see into 
582,,,the chapel that was the only thing there
583,0:39:00,Adrian,that’s a difficult one because if they can see out then people would be 
584,,,able to see in
585,,Angela,well the mirrored glass is what we’re looking at doing having 
586,,,installation of a mirrored glass system whereby people wouldn’t 
587,,,actually see you sitting in there working it typing tapping things in so 
588,,,that’s one of the things that we felt perhaps for our existing chapel that 
589,,,we were keen on doing
590,,Chris,I mean this [begins to point] idea was based on our existing chapel it’s not 
591,,,going to work is it in our existing chapel as we thought it would
592,,Angela,no we have an awful lot of additional electronics that systems 
593,,,recording systems so that we can play all sorts of tapes musics 
594,,,et cetera erm recording the funeral as well we’re planning to record 
595,,,funerals for families on to CD disks and also the possibility of relaying 
596,,,the funeral over the web to other people that can’t make the funeral as 
597,,,well and that system is going to be up and running in our chapel so the 
598,0:40:00,,spaghetti and all the other software is quite vast and is at the moment 
599,,,sort of spoiling the appearance of our chapel + at the moment
600,,,and so we want to move it into a room that can’t be seen and hide it 
601,,,really that’s what we’re doing
602,,Adrian,that was the intention of that room that’s er-
603,,Angela,indeed and that was er yes yes so we’re looking at you know the 
604,,,concern I’ve got is in a sense that what I would like is just to have the 
605,,,organ here and everything else to do with the music system that we 
606,,,would work CD player MP3 player whatever now that we’re going to 
607,,,be doing is all in there
608,,Adrian,I think we’re thinking along the same lines I mean that was certainly 
609,,,my intention to have a minimum of controls in here [begins to point] the 
610,,,point I’m not quite getting my head around is whether you would want 
611,,,the person who controls this to be in here or sitting here certainly if he’s 
612,,,sat here he or she’s sat here then they could just operate a few controls 
613,,,that would remotely operate all the equipment in there and they would 
614,0:41:00,,obviously be part of the service but not necessarily clicking away on the 
615,,,keyboard the keyboard and stuff can certainly /be hidden in there\
616,,Angela,/be hidden in there\ OK
617,,Adrian,if they need to go away and do that they can sh- shut themselves in and 
618,,,do it
619,,Angela,OK
620,,Adrian,erm do you think that would work that way round
621,,Angela,yes I mean it wouldn’t be impossible yes I mean it was just the 
622,,Chris,I think there is because while they’re there [begins to point] I guess 
623,,,they’re not helping in dealing with this service but looking at the future 
624,,,services
625,,Angela,yes they’re getting ready prepared they might have had a disk brought 
626,,,in or there might be a request to sort of down I mean we could get it 
627,,,within the service times that’s the only thing
628,,Chris,and the other bonus of them not being actually sitting in there was that 
629,,,they could communicate then outside the other issue we looked at was 
630,,,because this person erm [begins to point] also is monitoring in the ideal 
631,0:42:00,,world what’s happening out here and what’s happening out here so ah 
632,,,they’re not only dealing with this the current funeral but the previous one 
633,,,and the one to come
634,,Angela,see when they’re arriving
635,,Adrian,[begins to sketch] the answer is then to have a door there
636,,Chris,a door
637,,Adrian,maybe a window 
638,,Chris,a window
639,,Adrian,and they can
640,,Chris,and a window this way
641,,Angela,to see when the next one’s arriving so you can see that the other one 
642,,,has arrived and they can get ready for that they can go out to the 
643,,,minister and go come on hurry up [laughs] so that’s what they what they 
644,,,what the staff would like would be to see the access at the moment 
645,,,because of [begins to point] the existing chapel we’re adding a room on to 
646,,,the back possibly they’ll be able to see down to the drive to see the next 
647,,,funeral arriving and know that it’s here and so that that’s that’s quite we 
648,,,thought about cameras and all sorts of things for that so that now would 
649,,,possibly do away with the thought of having cameras down the drive to 
650,0:43:00,,see the next funeral arriving and that’s why er the thought of having the 
651,,,door here might be better for us but I don’t know how that upsets the 
652,,,feeling of what you’ve got here and where the roof space is in a sense 
653,,,there the roof carries over from here doesn’t it
654,,Adrian,yes the roof flies over I would be resistant to having a 
655,,Angela,yes
656,,Adrian,door there because I think it would spoil the you know the chapel
657,,Angela,it’s not a door but a small room for the music room the music room is
658,,,sort of swinging round a bit here instead but I don’t know how that 
659,,,would spoil the feeling for that not wanting to disrupt too much
660,,Adrian,yes if I could go back to the architectural concept [pulls out drawing] on 
661,,,that show you where I’m coming from I’ve done these concept diagrams 
662,,,to try and explain how what holds the architecture together because the 
663,,,building as I mentioned before is a combination of four strips of what we 
664,,,call servant space which are low spaces and three strips of served space 
665,,,which are the barrel vaulted spaces and you put those together and you 
666,,,get this combination of ser- servant served servant served servant 
667,,,served and servant so I’ve been trying my hardest to keep all the 
668,,,important spaces like the chapel and things (  ) entrance so on 
669,,,and so forth vestry and the major staff rooms that more important 
670,,,spaces under the barrel vaults and keep all the supporting 
671,,,accommodation under the served if we then went back to the plan 
672,,,having explained that [replaces drawing] you know what I can do to 
673,,,make your idea work is to suggest that we do something like this [begins 
674,,,to sketch] and make this all perhaps one room and put a window in there 
675,,,and then you can get access through here and you can get a view out that 
676,,,way erm you could have a door this side if that helps you but erm I think 
677,,,that might satisfy your needs +++
678,,Chris,it probably needs to be open in terms of 
679,0:45:00,Adrian,mutually (  ) glazed or do you want a view is that the sort of thing you 
680,,,want 
681,,Chris,yes
682,,Angela,you don’t want a door because that would just mean the funeral 
683,,,directors in and out in and out all the time and they should be in there 
684,,,anyway
685,,Chris,well [points] no I mean there
686,,Angela,from this side I don’t want particularly a door [points] because it’s also 
687,,,going to
688,,Adrian,a short cut yeah
689,,Angela,it’s also going to [begins to point] interrupt this flow of space here as well 
690,,,isn’t it a door people sort of popping in and out there it looks like that 
691,,,might be the entrance to the chapel or not too sure so the less doors we 
692,,,have I mean the door that you want is just the exit door if you put 
693,,,another door up there people are going to start thinking you know 
694,,,we’re late for the funeral if we tap on this door here rather than going 
695,,,round to the right door it would be all over the place really the more 
696,,,doors we have the more confusing it gets for people one door in one 
697,,,door out basically is the easiest route for people add another door and 
698,,,they’ll just go oh what’s that + there was a toilet there that was quite-
699,,Adrian,you’ve still got another toilet there
700,,Angela,that’s OK
701,0:46:00,Adrian,I gave you two before but maybe you only need one I mean you’ve got 
702,,,two [points] at the entrance another one here so there’s not actually any 
703,,,shortage of loos so 
704,,Angela,OK yes yes that would be fine
705,,Adrian,we could do that ++ and then-
706,,Angela,what were your thoughts Chris on that do you think that’s + I mean I 
707,,,think that would be +++ (you see the next)
708,,Chris,hmmm the only concern I’ve got is [begins to point] if we’re moving a 
709,,,person from inside to here ++++ it’s how they monitor what’s going on 
710,,,here from this position + the advantage of having it here is the door can 
711,,,be open + unless they’re doing something noisy then just close the door
712,,Angela,yes
713,,Chris,er it’s then how they monitor what’s going on here I don’t know how 
714,,,theatre technicians do that are they completely enclosed or have they 
715,0:47:00,,got some sort of sliding window type of thing so that they can slide it 
716,,,shut +++ er I mean I know sound engineers are in the they like to be 
717,,,within the audience but I mean we’re not at that level
718,,Angela,not yet [all laugh] feels a bit like that at the moment yes it 
719,,,feels like there will be mixing desks that’s all we need ++
720,,Adrian,well there might be another way of looking at this if you specifically 
721,,,wanted a theatre technicians room then I could look into putting another 
722,,,sort of bold architectural shape in this vicinity that might satisfy what 
723,,,you’re looking for where the guy would literally sit in there and he 
724,,,would look straight forward perhaps through some covered glass 
725,,,or mirrored glass or whatever erm ++ and I might still be able to integrate 
726,0:48:00,,it into the architectural form I’ve got other bold forms on this axis I’m 
727,,,thinking I might be able to do something here that might satisfy that 
728,,,need erm without making it look like an afterthought that’s not what I 
729,,,imagined this elevation would look like at all +
730,,Chris,no I mean it might be- ++
731,,Adrian,if you don’t think this could work I mean I’m still struggling to get my 
732,,,head around exactly how you see this working coz I always thought 
733,,,that we’d need an organ here anyway would we not 
734,,Chris,an organ is now a very rarely used
735,,Angela,rarely used item
736,,Adrian,would you not want an organ
737,,Angela,well I + I don’t know it’s difficult to say not I mean most of (  ) 
738,,,could bring a keyboard in in a sense so it’s not + hmm difficult I 
739,,,would have to say that we wouldn’t need an organist but at the same 
740,0:49:00,,time people expect us to get one they expect one to be here just for the 
741,,,thought of they don’t like the idea of us playing a CD for a hymn 
742,,,instead +++
743,,Adrian,so so there’s this this a need for something there which would relate to 
744,,,AV in some way 
745,,Chris,well I mean the other thing is if if there’s going to be slideshows video 
746,,,which is increasingly becoming you know people almost expect it that 
747,,,they I mean I’ve seen it at church services where for funerals where 
748,,,people have had you’ve walked into before a service a er a series of stills 
749,,,of the persons life erm and I think sort of thing is going to increase videos 
750,,,or there’s certainly erm books of photographs or display of photographs at 
751,0:50:00,,the back of a service things like that
752,,Angela,yes we’ve had a lot of cine films being played of people cause they’re 
753,,,obviously that sort of age perhaps or videos or sometimes they wanted 
754,,,their favourite video played we’ve had one or two sort of disney films 
755,,,played for the children’s funeral where there’s a lot of children they 
756,,,want a little bit of music played that’s on a video they’ve got so they’ve 
757,,,brought the video in to be played for the musics
758,,Adrian,[sketches] do we need some sort of surface around here where you can 
759,,,put a book or something that might form of this end elevation erm do we 
760,,,need some-
